{
  "$contract": "soter://contracts/host-adapter/v1",
  "contractVersion": "1.0.0",
  "id": "host.codex",
  "host": "codex",
  "version": "0.1.0",
  "releaseStage": "experimental",
  "evidenceMaturity": "declared",
  "summary": "Projects resolved Soter behavior into Codex instructions, skills, tools, lifecycle controls, and structured task workflows.",
  "projections": [
    { "path": "AGENTS.md", "role": "instructions" },
    { "path": ".codex/config.toml", "role": "tools" }
  ],
  "mcpServers": [
    {
      "id": "soter",
      "delivery": "project",
      "state": "configured",
      "configurationPath": ".codex/config.toml",
      "reason": "The trusted project config exposes the provider-neutral Core service through a local stdio MCP server."
    },
    {
      "id": "notion",
      "delivery": "connector",
      "state": "declared",
      "reason": "The Notion app connector supplies authenticated workspace tools outside repository configuration."
    },
    {
      "id": "otter",
      "delivery": "project",
      "state": "configured",
      "configurationPath": ".codex/config.toml",
      "reason": "The trusted project config declares Otter's OAuth-authenticated streamable HTTP MCP server."
    }
  ],
  "mechanisms": {
    "instructions": "available",
    "skills": "declared",
    "tools": "available",
    "lifecycle": "declared",
    "compactionRehydration": "declared",
    "backgroundRuns": "declared",
    "structuredOutput": "declared"
  },
  "conformance": {
    "maxLevel": "static",
    "scenarios": []
  },
  "limitations": [
    "The local Core MCP service durably checkpoints calls and Otter is configured, but Codex startup, connector authentication, real provider dispatch, checkpoint recovery by the host, lifecycle judgment, and end-to-end behavior conformance are not proven."
  ]
}
